### ISSUE TITLE
Bug: ArtNet consumer not rasterizing image correctly

### ISSUE THREAD

**Issue by dimitry-ishenko** [CasparCG/server#1749]
### Observed Behavior

With this config:
```xml
<?xml version="1.0" encoding="utf-8"?>

<configuration>
    <paths>
        <media-path>media/</media-path>
        <log-path disable="false">log/</log-path>
        <data-path>data/</data-path>
        <template-path>template/</template-path>
    </paths>
    <lock-clear-phrase>secret</lock-clear-phrase>
    <video-modes>
        <video-mode>
            <id>144x72p60</id>
            <width>144</width>
            <height>72</height>
            <time-scale>60000</time-scale>
            <duration>1000</duration>
            <cadence>800</cadence>
        </video-mode>
    </video-modes>
    <channels>
        <channel>
            <!-- <video-mode>144x72p60</video-mode> -->
            <video-mode>144x72p60</video-mode>
            <consumers>
                <screen />

                <artnet>
                    <universe>0</universe>
                    <host>10.42.0.21</host>
                    <port>6454</port>
                    <refresh-rate>30</refresh-rate>
                    <fixtures>
                        <!-- Row 0 -->
                        <fixture>
                            <type>RGBW</type>
                            <start-address>1</start-address>
                            <fixture-count>18</fixture-count>
                            <fixture-channels>4</fixture-channels>
                            <x>72</x>
                            <y>36</y>
                            <width>144</width>
                            <height>72</height>
                            <rotation>0</rotation>
                        </fixture>
                    </fixtures>
                </artnet>

            </consumers>
        </channel>
    </channels>
    <controllers>
        <tcp>
            <port>5250</port>
            <protocol>AMCP</protocol>
        </tcp>
    </controllers>
    <amcp>
        <media-server>
            <host>localhost</host>
            <port>8000</port>
        </media-server>
    </amcp>
</configuration>
```
If I play this image:

<img width="144" height="72" alt="Image" src="https://github.com/user-attachments/assets/e845ea18-6787-405a-9ef3-eaca4c4983b7" />

I see a row of red pixels followed by green pixels. And, the server generates the following ArtNet packets:

```
22:44:24.186051 eth0  In  IP laptop.39323 > FPP.6454: UDP, length 530
	0x0000:  4500 022e 854d 4000 4011 9e81 0a2a 0088  E....M@.@....*..
	0x0010:  0a2a 0015 999b 1936 021a 4fff 4172 742d  .*.....6..O.Art-
	0x0020:  4e65 7400 0050 000e 0000 0000 0200 ff00  Net..P..........
	0x0030:  0000 ff00 0000 ff00 0000 ff00 0000 ff00  ................
	0x0040:  0000 ff00 0000 ff00 0000 ff00 0000 ff00  ................
	0x0050:  0000 6a94 0000 00ff 0000 00ff 0000 00ff  ..j.............
	0x0060:  0000 00ff 0000 00ff 0000 00ff 0000 00ff  ................
	0x0070:  0000 00ff 0000 0000 0000 0000 0000 0000  ................
	0x0080:  0000 0000 0000 0000 0000 0000 0000 0000  ................
	0x0090:  0000 0000 0000 0000 0000 0000 0000 0000  ................
	0x00a0:  0000 0000 0000 0000 0000 0000 0000 0000  ................
	0x00b0:  0000 0000 0000 0000 0000 0000 0000 0000  ................
	0x00c0:  0000 0000 0000 0000 0000 0000 0000 0000  ................
	0x00d0:  0000 0000 0000 0000 0000 0000 0000 0000  ................
	0x00e0:  0000 0000 0000 0000 0000 0000 0000 0000  ................
	0x00f0:  0000 0000 0000 0000 0000 0000 0000 0000  ................
	0x0100:  0000 0000 0000 0000 0000 0000 0000 0000  ................
	0x0110:  0000 0000 0000 0000 0000 0000 0000 0000  ................
	0x0120:  0000 0000 0000 0000 0000 0000 0000 0000  ................
	0x0130:  0000 0000 0000 0000 0000 0000 0000 0000  ................
	0x0140:  0000 0000 0000 0000 0000 0000 0000 0000  ................
	0x0150:  0000 0000 0000 0000 0000 0000 0000 0000  ................
	0x0160:  0000 0000 0000 0000 0000 0000 0000 0000  ................
	0x0170:  0000 0000 0000 0000 0000 0000 0000 0000  ................
	0x0180:  0000 0000 0000 0000 0000 0000 0000 0000  ................
	0x0190:  0000 0000 0000 0000 0000 0000 0000 0000  ................
	0x01a0:  0000 0000 0000 0000 0000 0000 0000 0000  ................
	0x01b0:  0000 0000 0000 0000 0000 0000 0000 0000  ................
	0x01c0:  0000 0000 0000 0000 0000 0000 0000 0000  ................
	0x01d0:  0000 0000 0000 0000 0000 0000 0000 0000  ................
	0x01e0:  0000 0000 0000 0000 0000 0000 0000 0000  ................
	0x01f0:  0000 0000 0000 0000 0000 0000 0000 0000  ................
	0x0200:  0000 0000 0000 0000 0000 0000 0000 0000  ................
	0x0210:  0000 0000 0000 0000 0000 0000 0000 0000  ................
	0x0220:  0000 0000 0000 0000 0000 0000 0000       ..............
```
So far so good.

### Expected behaviour

If I change the height to 36 in the fixture section:
```xml
                <artnet>
                    <universe>0</universe>
                    <host>10.42.0.21</host>
                    <port>6454</port>
                    <refresh-rate>30</refresh-rate>
                    <fixtures>
                        <!-- Row 0 -->
                        <fixture>
                            <type>RGBW</type>
                            <start-address>1</start-address>
                            <fixture-count>18</fixture-count>
                            <fixture-channels>4</fixture-channels>
                            <x>72</x>
                            <y>36</y>
                            <width>144</width>
                            <height>36</height>
                            <rotation>0</rotation>
                        </fixture>
                    </fixtures>
                </artnet>
```

I start seeing some green bleeding into all of the red pixels, and some red bleeding into all of the green pixels. Here are the packets sent by the server which confirm my observation:

```
22:50:43.900869 eth0  In  IP laptop.49759 > FPP.6454: UDP, length 530
	0x0000:  4500 022e 7cb9 4000 4011 a715 0a2a 0088  E...|.@.@....*..
	0x0010:  0a2a 0015 c25f 1936 021a 2a49 4172 742d  .*..._.6..*IArt-
	0x0020:  4e65 7400 0050 000e 0000 0000 0200 d925  Net..P.........%
	0x0030:  0000 d925 0000 d925 0000 d925 0000 d925  ...%...%...%...%
	0x0040:  0000 d925 0000 d925 0000 d925 0000 d925  ...%...%...%...%
	0x0050:  0000 728c 0000 29d5 0000 29d5 0000 29d5  ..r...)...)...).
	0x0060:  0000 29d5 0000 29d5 0000 29d5 0000 29d5  ..)...)...)...).
	0x0070:  0000 2cd2 0000 0000 0000 0000 0000 0000  ..,.............
	0x0080:  0000 0000 0000 0000 0000 0000 0000 0000  ................
	0x0090:  0000 0000 0000 0000 0000 0000 0000 0000  ................
	0x00a0:  0000 0000 0000 0000 0000 0000 0000 0000  ................
	0x00b0:  0000 0000 0000 0000 0000 0000 0000 0000  ................
	0x00c0:  0000 0000 0000 0000 0000 0000 0000 0000  ................
	0x00d0:  0000 0000 0000 0000 0000 0000 0000 0000  ................
	0x00e0:  0000 0000 0000 0000 0000 0000 0000 0000  ................
	0x00f0:  0000 0000 0000 0000 0000 0000 0000 0000  ................
	0x0100:  0000 0000 0000 0000 0000 0000 0000 0000  ................
	0x0110:  0000 0000 0000 0000 0000 0000 0000 0000  ................
	0x0120:  0000 0000 0000 0000 0000 0000 0000 0000  ................
	0x0130:  0000 0000 0000 0000 0000 0000 0000 0000  ................
	0x0140:  0000 0000 0000 0000 0000 0000 0000 0000  ................
	0x0150:  0000 0000 0000 0000 0000 0000 0000 0000  ................
	0x0160:  0000 0000 0000 0000 0000 0000 0000 0000  ................
	0x0170:  0000 0000 0000 0000 0000 0000 0000 0000  ................
	0x0180:  0000 0000 0000 0000 0000 0000 0000 0000  ................
	0x0190:  0000 0000 0000 0000 0000 0000 0000 0000  ................
	0x01a0:  0000 0000 0000 0000 0000 0000 0000 0000  ................
	0x01b0:  0000 0000 0000 0000 0000 0000 0000 0000  ................
	0x01c0:  0000 0000 0000 0000 0000 0000 0000 0000  ................
	0x01d0:  0000 0000 0000 0000 0000 0000 0000 0000  ................
	0x01e0:  0000 0000 0000 0000 0000 0000 0000 0000  ................
	0x01f0:  0000 0000 0000 0000 0000 0000 0000 0000  ................
	0x0200:  0000 0000 0000 0000 0000 0000 0000 0000  ................
	0x0210:  0000 0000 0000 0000 0000 0000 0000 0000  ................
	0x0220:  0000 0000 0000 0000 0000 0000 0000       ..............
```

If I further reduce the height to 6 pixels:
```xml
                <artnet>
                    <universe>0</universe>
                    <host>10.42.0.21</host>
                    <port>6454</port>
                    <refresh-rate>30</refresh-rate>
                    <fixtures>
                        <!-- Row 0 -->
                        <fixture>
                            <type>RGBW</type>
                            <start-address>1</start-address>
                            <fixture-count>18</fixture-count>
                            <fixture-channels>4</fixture-channels>
                            <x>72</x>
                            <y>36</y>
                            <width>144</width>
                            <height>6</height>
                            <rotation>0</rotation>
                        </fixture>
                    </fixtures>
                </artnet>
```
The bleeding gets worse and the pixels are barely distinguishable::
```
22:51:54.805289 eth0  In  IP laptop.47056 > FPP.6454: UDP, length 530
	0x0000:  4500 022e afb9 4000 4011 7415 0a2a 0088  E.....@.@.t..*..
	0x0010:  0a2a 0015 b7d0 1936 021a 2ae2 4172 742d  .*.....6..*.Art-
	0x0020:  4e65 7400 0050 000e 0000 0000 0200 a757  Net..P.........W
	0x0030:  0000 a757 0000 a757 0000 a757 0000 a757  ...W...W...W...W
	0x0040:  0000 a757 0000 a757 0000 a757 0000 a757  ...W...W...W...W
	0x0050:  0000 7e80 0000 619d 0000 619d 0000 619d  ..~...a...a...a.
	0x0060:  0000 619d 0000 619d 0000 619d 0000 619d  ..a...a...a...a.
	0x0070:  0000 649a 0000 0000 0000 0000 0000 0000  ..d.............
	0x0080:  0000 0000 0000 0000 0000 0000 0000 0000  ................
	0x0090:  0000 0000 0000 0000 0000 0000 0000 0000  ................
	0x00a0:  0000 0000 0000 0000 0000 0000 0000 0000  ................
	0x00b0:  0000 0000 0000 0000 0000 0000 0000 0000  ................
	0x00c0:  0000 0000 0000 0000 0000 0000 0000 0000  ................
	0x00d0:  0000 0000 0000 0000 0000 0000 0000 0000  ................
	0x00e0:  0000 0000 0000 0000 0000 0000 0000 0000  ................
	0x00f0:  0000 0000 0000 0000 0000 0000 0000 0000  ................
	0x0100:  0000 0000 0000 0000 0000 0000 0000 0000  ................
	0x0110:  0000 0000 0000 0000 0000 0000 0000 0000  ................
	0x0120:  0000 0000 0000 0000 0000 0000 0000 0000  ................
	0x0130:  0000 0000 0000 0000 0000 0000 0000 0000  ................
	0x0140:  0000 0000 0000 0000 0000 0000 0000 0000  ................
	0x0150:  0000 0000 0000 0000 0000 0000 0000 0000  ................
	0x0160:  0000 0000 0000 0000 0000 0000 0000 0000  ................
	0x0170:  0000 0000 0000 0000 0000 0000 0000 0000  ................
	0x0180:  0000 0000 0000 0000 0000 0000 0000 0000  ................
	0x0190:  0000 0000 0000 0000 0000 0000 0000 0000  ................
	0x01a0:  0000 0000 0000 0000 0000 0000 0000 0000  ................
	0x01b0:  0000 0000 0000 0000 0000 0000 0000 0000  ................
	0x01c0:  0000 0000 0000 0000 0000 0000 0000 0000  ................
	0x01d0:  0000 0000 0000 0000 0000 0000 0000 0000  ................
	0x01e0:  0000 0000 0000 0000 0000 0000 0000 0000  ................
	0x01f0:  0000 0000 0000 0000 0000 0000 0000 0000  ................
	0x0200:  0000 0000 0000 0000 0000 0000 0000 0000  ................
	0x0210:  0000 0000 0000 0000 0000 0000 0000 0000  ................
	0x0220:  0000 0000 0000 0000 0000 0000 0000       ..............
```

Not sure if I am doing something wrong, or there is a bug in the ArtNet consumer?

**Comment by dimitry-ishenko** [comment]
@firecraftgaming any ideas?

**Comment by dimitry-ishenko** [comment]
Also, the consumer is limited to only one DMX universe. And, for some reason, I can't seem to create more than one consumer on the same channel...

**Comment by dimitry-ishenko** [comment]
> And, for some reason, I can't seem to create more than one consumer on the same channel...

Hmm, that seems to be a general limitation... @Julusian is there no way to add more than one instance of the same type of consumer to the same channel?

**Comment by firecraftgaming** [comment]
It was a while ago I worked on it, but I am happy to try to take a look.

Albeit, I remember seeing some of these errors whilst using it myself about 2 years ago, I think I fixed some of those on my own fork https://github.com/firecraftgaming/caspar-server/tree/fix-artnet. But, these includes changes from another branch I had also, and I didnt make a PR yet, since I wanted the other branch to get merged first, but it still hasnt gotten reviewed, so it got forgotten.

**Comment by dimitry-ishenko** [comment]
@firecraftgaming what are your thoughts on the following:

- I am basically trying to map channel output to an RGBW LED matrix. There are a number of controllers that will accept ArtNet data and map it to LED strips.

- Single universe limitation is a bummer. It only allows 128 RGBW LEDs. My idea was for it be the starting universe and allow the number of channels to extend beyond 512.

- I was thinking of making the `<fixture-count>` parameter accept values like 128x128 instead of specifying individual rows.

- Using `<x>` and `<y>` to specify the center of the region is a royal PITA, if you ask me. I'd like to either repurpose them to be the top-left corner (breaking change) or maybe add `<top>` and `<left>` tags for that.

- How important is the `<rotation>` parameter and can't that be handled by the mixer (ie, rotate the image)? The reason I am asking is that instead of doing home-grown color averaging, we can use `sws_scale()` function to re-scale the region of the image to the exact fixture matrix and then just grab one pixel for each fixture. The only problem is that `sws_scale()` doesn't do rotation.

- I'd like to be able to specify flux values for the LEDs so that RGB colors can be properly translated to the corresponding R, G, B and W values.

**Comment by firecraftgaming** [comment]
@dimitry-ishenko 

I think thats a pretty cool idea.

I did not know about the `sws_scale()` method, so thank you, I think it could hugely help here. Didnt think of that either, but yeah, rotation can absolutely be handled in the mixer, would make this all easier as well. The reason for x, y to be center was for rotation, so I want them top-left now also, I am just thinking about how to do that without breaking changes, but I am liking your suggestion with `<top>` and `<left>` as alternatives. 

I havent looked at multi universe before, as my view on it was that you could simple create more consumers for that (before I realised you could max have one consumer, which was fixed by having a sub list in the consumer), but I see your vision, and agree that multi-universe per fixture group would be good.

With the flux / rgbw translation, do you have a specific format or way of exposing that. What would you think would fit the best?

**Comment by dimitry-ishenko** [comment]
@firecraftgaming I thought this over and realized the goals we are trying to achieve are somewhat different. Your approach is oriented towards fixtures with different channel numbers, covering different regions, etc. My goal is essentially to output channel content onto a pixel matrix.

I ended up making a super stripped down version and called it pixel consumer. It has minimal processing and relies on the channel and mixer to do most of the heavy lifting. You can find it in #1751.

To use it, you define a custom channel resolution that matches dimensions of the pixel matrix and refresh rate. When you play an image or a video the channel will automatically re-scale the contents to fill the matrix. And you can use MIXER commands to display a sub-region and/or rotate it.

I am planning to add coefficients to account for different flux values for each color, and maybe "zig-zag" and "reverse" options to accommodate different wiring patterns (although most pixel controllers can do that already).

If you want, take a look and maybe we can figure out how to integrate them. I have a stiff deadline to get this thing into production, so I will have to focus on that.

@Julusian I'd be interested in hearing your opinion whether you think we should keep them separate to try to merge them into one.

**Comment by dimitry-ishenko** [comment]
My other thought was that if we keep it as a separate pixel consumer, we can also add other protocols to it in the future (eg, sACN) that are popular in the pixel matrix community.

**Comment by firecraftgaming** [comment]
@dimitry-ishenko 

I see your vision, and I think that could very well be accomodated for in the artnet consumer. Although I see your stiff deadline, and if you feel like the pixel consumer is better to get it up and running that is probably a good idea. 

I have made a new branch that I think should accomodate the needs you have described, however it is currently fully untested, which is why I haven't created a PR for it yet.

If you want to test it, it lives on this branch https://github.com/firecraftgaming/caspar-server/tree/improved-artnet

**Comment by Julusian** [comment]
> Hmm, that seems to be a general limitation... @Julusian is there no way to add more than one instance of the same type of consumer to the same channel?

Consumers are 'deduplicated' based on the port number they assign themselves. which is pretty baked into the protocol in a way, as it allows for things like `REMOVE 1 DECKLINK 3` to remove the correct thing.

I'm not sure how best to handle that for this artnet one, but it will need to assign itself a different number to allow multiple on a channel.

----

> My other thought was that if we keep it as a separate pixel consumer,

I dont think that is a problem with the current artnet name, we can either alias the name in the future, or leave it a little confusing but perhaps more descriptive in intention.

----

> I'd be interested in hearing your opinion whether you think we should keep them separate to try to merge them into one.

I think it would be good to try and combine them so that we have a clearer set of functionality (and less confusion about which to use). I havent read the above enough to get an idea on how viable that is, so do push back if it seems problematic
